<?xml version="1.0" encoding="UTF-8"?>
<!--
   DO NOT ALTER OR REMOVE COPYRIGHT NOTICES OR THIS HEADER.
  
    Copyright (c) 2006 Sun Microsystems Inc. All Rights Reserved
  
    The contents of this file are subject to the terms
    of the Common Development and Distribution License
    (the License). You may not use this file except in
    compliance with the License.

    You can obtain a copy of the License at
    https://opensso.dev.java.net/public/CDDLv1.0.html or
    opensso/legal/CDDLv1.0.txt
    See the License for the specific language governing
    permission and limitations under the License.

    When distributing Covered Code, include this CDDL
    Header Notice in each file and include the License file
    at opensso/legal/CDDLv1.0.txt.
    If applicable, add the following below the CDDL Header,
    with the fields enclosed by brackets [] replaced by
    your own identifying information:
    "Portions Copyrighted [year] [name of copyright owner]"

    $Id: Membership.xml,v 1.11 2009/07/16 04:12:03 cbasha Exp $

-->

<!--
Portions Copyrighted 2011-2013 ForgeRock AS
-->

<!DOCTYPE ModuleProperties PUBLIC "=//iPlanet//Authentication Module Properties XML Interface 1.0 DTD//EN"
        "jar://com/sun/identity/authentication/Auth_Module_Properties.dtd">

<ModuleProperties moduleName="Membership" version="1.0" >

    <Callbacks length="3" order="1" timeout="120" header="自注册模块" template="membership.jsp" >
        <NameCallback>
            <Prompt>用户名:</Prompt>
        </NameCallback>
        <PasswordCallback echoPassword="false" >
            <Prompt>密码:</Prompt>    
        </PasswordCallback>
        <ConfirmationCallback>
            <OptionValues>
                <OptionValue>
                    <Value>登录</Value>
                </OptionValue>
                <OptionValue>
                    <Value>新建用户</Value>
                </OptionValue>
             </OptionValues>
        </ConfirmationCallback>
    </Callbacks>
    
    <Callbacks length="0" order="2" timeout="120" template="disclaimerDeclined.jsp" error="true" />
    
    <Callbacks length="0" order="3" timeout="120" template="profileError.jsp" error="true" />

    <Callbacks length="8" order="4" timeout="300" header="自注册" template="register.jsp" >
        <NameCallback isRequired="true" attribute="uid" >
            <Prompt>用户名:</Prompt>
        </NameCallback>
        <PasswordCallback echoPassword="false" isRequired="true" attribute="userPassword" >
            <Prompt>密码:</Prompt>    
        </PasswordCallback>
        <PasswordCallback echoPassword="false" isRequired="true" >
            <Prompt>确认密码:</Prompt>    
        </PasswordCallback>
        <NameCallback isRequired="true" attribute="givenname" >
            <Prompt>名字:</Prompt>
        </NameCallback>
        <NameCallback isRequired="true" attribute="sn" >
            <Prompt>姓氏:</Prompt>
        </NameCallback>
        <NameCallback isRequired="true" attribute="cn" >
            <Prompt>全名:</Prompt>
        </NameCallback>
        <NameCallback attribute="mail" >
            <Prompt>电子邮件地址:</Prompt>
        </NameCallback>
        <ConfirmationCallback>
            <OptionValues>
                <OptionValue>
                    <Value>注册</Value>
                </OptionValue>
                <OptionValue>
                    <Value>取消</Value>
                </OptionValue>
             </OptionValues>
        </ConfirmationCallback>
    </Callbacks>
    
    <Callbacks length="2" order="5" timeout="120" header="自注册" >
        <ChoiceCallback attribute="uid" >
            <Prompt>您输入的用户名已&lt;BR&gt;有用户使用。&lt;BR&gt;请从以下用户名中&lt;BR&gt;选择一个，&lt;BR&gt;或创建您自己的用户名:</Prompt>
            <ChoiceValues>
              <ChoiceValue>
                  <Value>创建自己的用户名</Value>
              </ChoiceValue>
            </ChoiceValues>
        </ChoiceCallback>
        <ConfirmationCallback>
            <OptionValues>
                <OptionValue>
                    <Value>提交</Value>
                </OptionValue>
            </OptionValues>
        </ConfirmationCallback>
    </Callbacks>
    
    <Callbacks length="1" order="6" timeout="120" template="disclaimer.jsp" >
        <ConfirmationCallback>
            <OptionValues>
                <OptionValue>
                    <Value>同意</Value>
                </OptionValue>
                <OptionValue>
                    <Value>不同意</Value>
                </OptionValue>
            </OptionValues>
        </ConfirmationCallback>
    </Callbacks>
    
</ModuleProperties>
