<?xml version="1.0" encoding="UTF-8"?>

<!--
    Copyright (c) 2005 Sun Microsystems, Inc. All rights reserved
    Use is subject to license terms.
-->

<!--
    Portions Copyrighted 2013 ForgeRock AS
-->

<!DOCTYPE ModuleProperties PUBLIC "=//iPlanet//Authentication Module Properties XML Interface 1.0 DTD//EN"
	"jar://com/sun/identity/authentication/Auth_Module_Properties.dtd">


<ModuleProperties moduleName="SecurID" version="1.0" >
    <Callbacks length="2" order="1" timeout="120" header="このサーバーは SecurID 認証を使用します" >
        <NameCallback>
            <Prompt>ユーザー ID を入力してください</Prompt>
        </NameCallback>
        <PasswordCallback echoPassword="false" >
            <Prompt>パスコードを入力してください</Prompt>
        </PasswordCallback>
    </Callbacks>
    <Callbacks length="1" order="2" timeout="120" header="新規 PIN モード" >
	<!-- TextInputCallback not implemented in UI -->
	<PasswordCallback echoPassword="false" >
	    <Prompt>新しい PIN メッセージを入力してください</Prompt>
	</PasswordCallback>
    </Callbacks>
    <Callbacks length="1" order="3" timeout="120" header="次のパスコード" >
	<PasswordCallback echoPassword="false" >
	    <Prompt>トークンでコードが変更されるまで待ち、次のパスコードを入力します:</Prompt>
	</PasswordCallback>
    </Callbacks>
    <Callbacks length="1" order="4" timeout="120" header="新規 PIN を生成中" >
	<!-- TextInputCallback not implemented in UI -->
	<NameCallback>
	    <Prompt>常に置換されます</Prompt>
	</NameCallback>
    </Callbacks>
    <Callbacks length="1" order="5" timeout="120" header="次のパスコード" >
	<PasswordCallback echoPassword="false" >
	    <Prompt>トークンがメッセージを変更するのをお待ちください</Prompt>
	</PasswordCallback>
    </Callbacks>
</ModuleProperties>

