<?xml version="1.0" encoding="UTF-8"?>
<!--
   DO NOT ALTER OR REMOVE COPYRIGHT NOTICES OR THIS HEADER.
  
    Copyright (c) 2007 Sun Microsystems Inc. All Rights Reserved
  
    The contents of this file are subject to the terms
    of the Common Development and Distribution License
    (the License). You may not use this file except in
    compliance with the License.

    You can obtain a copy of the License at
    https://opensso.dev.java.net/public/CDDLv1.0.html or
    opensso/legal/CDDLv1.0.txt
    See the License for the specific language governing
    permission and limitations under the License.

    When distributing Covered Code, include this CDDL
    Header Notice in each file and include the License file
    at opensso/legal/CDDLv1.0.txt.
    If applicable, add the following below the CDDL Header,
    with the fields enclosed by brackets [] replaced by
    your own identifying information:
    "Portions Copyrighted [year] [name of copyright owner]"

    $Id: RADIUS.xml,v 1.9 2009/07/16 04:12:01 cbasha Exp $

-->
<!--
    Portions Copyrighted 2013 ForgeRock AS
-->

<!DOCTYPE ModuleProperties PUBLIC "=//iPlanet//Authentication Module Properties XML Interface 1.0 DTD//EN"
	"jar://com/sun/identity/authentication/Auth_Module_Properties.dtd">


<ModuleProperties moduleName="RADIUS" version="1.0" >
    <Callbacks length="2" order="1" timeout="60" header="Ce serveur utilise l&apos;authentification RADIUS." >
        <NameCallback>
            <Prompt>ID RADIUS</Prompt>
        </NameCallback>
        <PasswordCallback echoPassword="false" >
            <Prompt>Mot de passe RADIUS</Prompt>
        </PasswordCallback>
    </Callbacks>
    <Callbacks length="1" order="2" timeout="60" header="Question/réponse pour la connexion RADIUS" >
        <PasswordCallback echoPassword="false" >
            <Prompt>Mot de passe question/réponse RADIUS</Prompt>
        </PasswordCallback>
    </Callbacks>
</ModuleProperties>
