<?xml version="1.0" encoding="UTF-8"?>

<!--
    Copyright (c) 2005 Sun Microsystems, Inc. All rights reserved
    Use is subject to license terms.
-->

<!--
    Portions Copyrighted 2013 ForgeRock AS
-->

<!DOCTYPE ModuleProperties PUBLIC "=//iPlanet//Authentication Module Properties XML Interface 1.0 DTD//EN"
	"jar://com/sun/identity/authentication/Auth_Module_Properties.dtd">


<ModuleProperties moduleName="SecurID" version="1.0" >
    <Callbacks length="2" order="1" timeout="120" header="此服务器使用 SecurID 验证" >
        <NameCallback>
            <Prompt>请输入您的用户 ID</Prompt>
        </NameCallback>
        <PasswordCallback echoPassword="false" >
            <Prompt>请输入您的密码</Prompt>
        </PasswordCallback>
    </Callbacks>
    <Callbacks length="1" order="2" timeout="120" header="新 PIN 模式" >
	<!-- TextInputCallback not implemented in UI -->
	<PasswordCallback echoPassword="false" >
	    <Prompt>请输入新的 PIN 消息</Prompt>
	</PasswordCallback>
    </Callbacks>
    <Callbacks length="1" order="3" timeout="120" header="下一个密码" >
	<PasswordCallback echoPassword="false" >
	    <Prompt>请等待更改令牌代码，然后输入下一个密码:</Prompt>
	</PasswordCallback>
    </Callbacks>
    <Callbacks length="1" order="4" timeout="120" header="生成新的 PIN" >
	<!-- TextInputCallback not implemented in UI -->
	<NameCallback>
	    <Prompt>总是替换</Prompt>
	</NameCallback>
    </Callbacks>
    <Callbacks length="1" order="5" timeout="120" header="下一个密码" >
	<PasswordCallback echoPassword="false" >
	    <Prompt>请等待令牌更改消息</Prompt>
	</PasswordCallback>
    </Callbacks>
</ModuleProperties>

