<?xml version="1.0" encoding="UTF-8"?>
<!--
   DO NOT ALTER OR REMOVE COPYRIGHT NOTICES OR THIS HEADER.
  
    Copyright (c) 2009 Sun Microsystems Inc. All Rights Reserved
  
    The contents of this file are subject to the terms
    of the Common Development and Distribution License
    (the License). You may not use this file except in
    compliance with the License.

    You can obtain a copy of the License at
    https://opensso.dev.java.net/public/CDDLv1.0.html or
    opensso/legal/CDDLv1.0.txt
    See the License for the specific language governing
    permission and limitations under the License.

    When distributing Covered Code, include this CDDL
    Header Notice in each file and include the License file
    at opensso/legal/CDDLv1.0.txt.
    If applicable, add the following below the CDDL Header,
    with the fields enclosed by brackets [] replaced by
    your own identifying information:
    "Portions Copyrighted [year] [name of copyright owner]"

    $Id: HOTP.xml,v 1.1 2009/07/16 04:12:03 cbasha Exp $

-->
<!--
    Portions Copyrighted 2012-2013 ForgeRock Inc
    Portions Copyrighted 2012 Nomura Research Institute, Ltd
-->

<!DOCTYPE ModuleProperties PUBLIC "=//iPlanet//Authentication Module Properties XML Interface 1.0 DTD//EN"
        "jar://com/sun/identity/authentication/Auth_Module_Properties.dtd">


<ModuleProperties moduleName="HOTP" version="1.0" >
    <Callbacks length="0" order="1" timeout="120" header="#WILL NOT BE SHOWN#" />
    <Callbacks length="2" order="2" timeout="120" header="此服务器使用 HOTP 验证。" >
        <PasswordCallback echoPassword="false" >
            <Prompt>输入 OTP 代码:</Prompt>
        </PasswordCallback>
        <ConfirmationCallback>
            <OptionValues>
                <OptionValue>
                    <Value>提交 OTP 代码</Value>

                </OptionValue>
                <OptionValue>
                    <Value>请求 OTP 代码</Value>
                </OptionValue>
             </OptionValues>
        </ConfirmationCallback>
    </Callbacks>
</ModuleProperties>
