<?xml version="1.0" encoding="UTF-8"?>
<!--
   DO NOT ALTER OR REMOVE COPYRIGHT NOTICES OR THIS HEADER.
  
    Copyright (c) 2006 Sun Microsystems Inc. All Rights Reserved
  
    The contents of this file are subject to the terms
    of the Common Development and Distribution License
    (the License). You may not use this file except in
    compliance with the License.

    You can obtain a copy of the License at
    https://opensso.dev.java.net/public/CDDLv1.0.html or
    opensso/legal/CDDLv1.0.txt
    See the License for the specific language governing
    permission and limitations under the License.

    When distributing Covered Code, include this CDDL
    Header Notice in each file and include the License file
    at opensso/legal/CDDLv1.0.txt.
    If applicable, add the following below the CDDL Header,
    with the fields enclosed by brackets [] replaced by
    your own identifying information:
    "Portions Copyrighted [year] [name of copyright owner]"

    $Id: Membership.xml,v 1.9 2009/07/16 04:12:00 cbasha Exp $

-->

<!--
    Portions Copyrighted 2011-2013 ForgeRock AS
-->

<!DOCTYPE ModuleProperties PUBLIC "=//iPlanet//Authentication Module Properties XML Interface 1.0 DTD//EN"
        "jar://com/sun/identity/authentication/Auth_Module_Properties.dtd">

<ModuleProperties moduleName="Membership" version="1.0" >

    <Callbacks length="3" order="1" timeout="120" header="Modul f체r Selbstregistrierung" template="membership.jsp" >
        <NameCallback>
            <Prompt>Benutzername</Prompt>
        </NameCallback>
        <PasswordCallback echoPassword="false" >
            <Prompt>Passwort:</Prompt>    
        </PasswordCallback>
        <ConfirmationCallback>
            <OptionValues>
                <OptionValue>
                    <Value>Anmelden</Value>
                </OptionValue>
                <OptionValue>
                    <Value>Neuer Benutzer</Value>
                </OptionValue>
             </OptionValues>
        </ConfirmationCallback>
    </Callbacks>
    
    <Callbacks length="0" order="2" timeout="120" template="disclaimerDeclined.jsp" error="true" />
    
    <Callbacks length="0" order="3" timeout="120" template="profileError.jsp" error="true" />
        
    <Callbacks length="8" order="4" timeout="300" header="Selbstregistrierung" template="register.jsp" >
        <NameCallback isRequired="true" attribute="uid" >
            <Prompt>Benutzername</Prompt>
        </NameCallback>
        <PasswordCallback echoPassword="false" isRequired="true" attribute="userPassword" >
            <Prompt>Passwort:</Prompt>    
        </PasswordCallback>
        <PasswordCallback echoPassword="false" isRequired="true" >
            <Prompt>Passwort best채tigen:</Prompt>    
        </PasswordCallback>
        <NameCallback isRequired="true" attribute="givenname" >
            <Prompt>Vorname:</Prompt>
        </NameCallback>
        <NameCallback isRequired="true" attribute="sn" >
            <Prompt>Nachname:</Prompt>
        </NameCallback>
        <NameCallback isRequired="true" attribute="cn" >
            <Prompt>Vollst채ndiger Name:</Prompt>
        </NameCallback>
        <NameCallback attribute="mail" >
            <Prompt>E-Mail-Adresse:</Prompt>
        </NameCallback>
        <ConfirmationCallback>
            <OptionValues>
                <OptionValue>
                    <Value>Registrieren</Value>
                </OptionValue>
                <OptionValue>
                    <Value>Abbrechen</Value>
                </OptionValue>
             </OptionValues>
        </ConfirmationCallback>
    </Callbacks>
    
    <Callbacks length="2" order="5" timeout="120" header="Selbstregistrierung" >
        <ChoiceCallback attribute="uid" >
            <Prompt>Es ist bereits ein Benutzer mit dem von Ihnen&lt;BR&gt;eingegebenen Benutzernamen vorhanden.&lt;BR&gt;W채hlen Sie einen der&lt;BR&gt;folgenden Benutzernamen aus,&lt;BR&gt;oder erstellen Sie einen eigenen:</Prompt>
            <ChoiceValues>
              <ChoiceValue>
                  <Value>Selbst erstellen</Value>
              </ChoiceValue>
            </ChoiceValues>
        </ChoiceCallback>
        <ConfirmationCallback>
            <OptionValues>
                <OptionValue>
                    <Value>Senden</Value>
                </OptionValue>
            </OptionValues>
        </ConfirmationCallback>
    </Callbacks>
    
    <Callbacks length="1" order="6" timeout="120" template="disclaimer.jsp" >
        <ConfirmationCallback>
            <OptionValues>
                <OptionValue>
                    <Value>Zustimmen</Value>
                </OptionValue>
                <OptionValue>
                    <Value>Nicht zustimmen</Value>
                </OptionValue>
            </OptionValues>
        </ConfirmationCallback>
    </Callbacks>
    
</ModuleProperties>
