<?xml version="1.0" encoding="UTF-8"?>

<!--
    Copyright (c) 2005 Sun Microsystems, Inc. All rights reserved
    Use is subject to license terms.
-->

<!--
    Portions Copyrighted 2013 ForgeRock AS
-->

<!DOCTYPE ModuleProperties PUBLIC "=//iPlanet//Authentication Module Properties XML Interface 1.0 DTD//EN"
	"jar://com/sun/identity/authentication/Auth_Module_Properties.dtd">


<ModuleProperties moduleName="SecurID" version="1.0" >
    <Callbacks length="2" order="1" timeout="120" header="Este servidor utiliza la autenticación de SecurID." >
        <NameCallback>
            <Prompt>Escriba el Id. de usuario</Prompt>
        </NameCallback>
        <PasswordCallback echoPassword="false" >
            <Prompt>Introduzca el código de acceso</Prompt>
        </PasswordCallback>
    </Callbacks>
    <Callbacks length="1" order="2" timeout="120" header="Nuevo modo PIN" >
	<!-- TextInputCallback not implemented in UI -->
	<PasswordCallback echoPassword="false" >
	    <Prompt>introduzca el mensaje PIN nuevo</Prompt>
	</PasswordCallback>
    </Callbacks>
    <Callbacks length="1" order="3" timeout="120" header="Siguiente código de acceso (PASSCODE)" >
	<PasswordCallback echoPassword="false" >
	    <Prompt>Espere a que cambie el token y después introduzca el siguiente código de acceso (PASSCODE):</Prompt>
	</PasswordCallback>
    </Callbacks>
    <Callbacks length="1" order="4" timeout="120" header="Generando el nuevo PIN" >
	<!-- TextInputCallback not implemented in UI -->
	<NameCallback>
	    <Prompt>Sustituir siempre</Prompt>
	</NameCallback>
    </Callbacks>
    <Callbacks length="1" order="5" timeout="120" header="Siguiente código de acceso (PASSCODE)" >
	<PasswordCallback echoPassword="false" >
	    <Prompt>espere a que el token cambie a msg</Prompt>
	</PasswordCallback>
    </Callbacks>
</ModuleProperties>

