<?xml version="1.0" encoding="UTF-8"?>
<!--
   DO NOT ALTER OR REMOVE COPYRIGHT NOTICES OR THIS HEADER.
  
    Copyright (c) 2006 Sun Microsystems Inc. All Rights Reserved
  
    The contents of this file are subject to the terms
    of the Common Development and Distribution License
    (the License). You may not use this file except in
    compliance with the License.

    You can obtain a copy of the License at
    https://opensso.dev.java.net/public/CDDLv1.0.html or
    opensso/legal/CDDLv1.0.txt
    See the License for the specific language governing
    permission and limitations under the License.

    When distributing Covered Code, include this CDDL
    Header Notice in each file and include the License file
    at opensso/legal/CDDLv1.0.txt.
    If applicable, add the following below the CDDL Header,
    with the fields enclosed by brackets [] replaced by
    your own identifying information:
    "Portions Copyrighted [year] [name of copyright owner]"

    $Id: Membership.xml,v 1.9 2009/07/16 04:12:01 cbasha Exp $

-->

<!--
Portions Copyrighted 2011-2013 ForgeRock AS
-->

<!DOCTYPE ModuleProperties PUBLIC "=//iPlanet//Authentication Module Properties XML Interface 1.0 DTD//EN"
        "jar://com/sun/identity/authentication/Auth_Module_Properties.dtd">

<ModuleProperties moduleName="Membership" version="1.0" >

    <Callbacks length="3" order="1" timeout="120" header="Module d&apos;auto-enregistrement" template="membership.jsp" >
        <NameCallback>
            <Prompt>Nom d&apos;utilisateur :</Prompt>
        </NameCallback>
        <PasswordCallback echoPassword="false" >
            <Prompt>Mot de passe :</Prompt>    
        </PasswordCallback>
        <ConfirmationCallback>
            <OptionValues>
                <OptionValue>
                    <Value>Connexion</Value>
                </OptionValue>
                <OptionValue>
                    <Value>Nouvel utilisateur</Value>
                </OptionValue>
             </OptionValues>
        </ConfirmationCallback>
    </Callbacks>
    
    <Callbacks length="0" order="2" timeout="120" template="disclaimerDeclined.jsp" error="true" />
    
    <Callbacks length="0" order="3" timeout="120" template="profileError.jsp" error="true" />
    
    <Callbacks length="8" order="4" timeout="300" header="Auto-enregistrement" template="register.jsp" >
        <NameCallback isRequired="true" attribute="uid" >
            <Prompt>Nom d&apos;utilisateur :</Prompt>
        </NameCallback>
        <PasswordCallback echoPassword="false" isRequired="true" attribute="userPassword" >
            <Prompt>Mot de passe :</Prompt>    
        </PasswordCallback>
        <PasswordCallback echoPassword="false" isRequired="true" >
            <Prompt>Confirmation du mot de passe :</Prompt>    
        </PasswordCallback>
        <NameCallback isRequired="true" attribute="givenname" >
            <Prompt>Prénom :</Prompt>
        </NameCallback>
        <NameCallback isRequired="true" attribute="sn" >
            <Prompt>Nom :</Prompt>
        </NameCallback>
        <NameCallback isRequired="true" attribute="cn" >
            <Prompt>Nom complet :</Prompt>
        </NameCallback>
        <NameCallback attribute="mail" >
            <Prompt>Adresse e-mail :</Prompt>
        </NameCallback>
        <ConfirmationCallback>
            <OptionValues>
                <OptionValue>
                    <Value>Enregistrer</Value>
                </OptionValue>
                <OptionValue>
                    <Value>Annuler</Value>
                </OptionValue>
             </OptionValues>
        </ConfirmationCallback>
    </Callbacks>
    
    <Callbacks length="2" order="5" timeout="120" header="Auto-enregistrement" >
        <ChoiceCallback attribute="uid" >
            <Prompt>Un utilisateur existe déjà pour&lt;BR&gt;le nom d&apos;utilisateur saisi.&lt;BR&gt;Veuillez sélectionner l&apos;un&lt;BR&gt;des noms suivants&lt;BR&gt;ou créez-en un nouveau :</Prompt>
            <ChoiceValues>
              <ChoiceValue>
                  <Value>Créer mon propre nom</Value>
              </ChoiceValue>
            </ChoiceValues>
        </ChoiceCallback>
        <ConfirmationCallback>
            <OptionValues>
                <OptionValue>
                    <Value>Envoyer</Value>
                </OptionValue>
            </OptionValues>
        </ConfirmationCallback>
    </Callbacks>
    
    <Callbacks length="1" order="6" timeout="120" template="disclaimer.jsp" >
        <ConfirmationCallback>
            <OptionValues>
                <OptionValue>
                    <Value>Accepter</Value>
                </OptionValue>
                <OptionValue>
                    <Value>Refuser</Value>
                </OptionValue>
            </OptionValues>
        </ConfirmationCallback>
    </Callbacks>
    
</ModuleProperties>
